CASEID,text,treat,pid_rep
251,"Loss of American Culture.  Loss of rights, money and services to Americans.  Lack of security.  Double standards.  Lack of unified English.  End of American way of life.",1. Worried,0.833
366,Immigration is fine as long as it is done legally.  People that are here illegally should be sent back to their country,0. Think,0.16666999
394,diseases,1. Worried,0
182,Mexican Illegals in America,0. Think,0.5
236,"I think of the AMERICAN BORN people, and how we've sacrificed to give them their freedom. I think a lot of people have becom frustrated with it all. When white people apply for a job (minimum wage) and they are told their salary is not negotiable, and yet the minority is able to negotiate a higher wage for the same job. It is discrimination against our own. I think of what Andy Rooney said a while ago about this very subject and agree completely. If you come to our Country - SPEAK ENGLISH. RESPECT OUR LAWS. OUR COUNTRY DOESN'T OWE YOU ANYTHING, WORK FOR IT LIKE THE REST OF US! Simply, I am against illegal immigrants, and legal immigrants should adjust to our ways, not us - to theirs.",0. Think,1
142,,0. Think,0.66667002
55,"People moving from one place to another, mostly for a better economic future.",0. Think,0.333
49,"bringing down our education systems, using up our government resouses less opportunities for americans for jobs, etc",0. Think,0.833
296,Those people that are here illegally should be sent back to their own country.  Mexicans,0. Think,0.5
37,"Racism & xenophobia make me worried!  Also, corporations using immigrant labor because it's cheaper for them and the ensuing loss of well-paying jobs worries me quite a bit. Vigilantes taking the law into their own hands at the border worries me.",1. Worried,0.5
302,,1. Worried,0.5
106,"that immigrants are the heart and soul and the creative growth that America has always had--all immigrants. That although we focus on Latinos there are illegals from many countries whose people we consider ""white"". That it would behoove us to find some way to tax any income from those who work here.It is wrong to take Social Security payments from people who will not receive it. Immigrants must become citizens within 2 years of their visa issue date unless a student.Students could get another 2 years until a degree is procured . Thereafter they leave or become citizens.We will expect other countries to require that from our citizens who live abroad.There should be a heavy tarriff on any money that leaves the U.S.by any electronic transfer, bank draft or otherwise. that it would then be cheaper for an immigrant to bring his family here than to send money out. That we are the second largest  source of revenue for the government of Mexico because immigrants send money home.",0. Think,0.5
385,job security for our citizens,1. Worried,0.5
369,"public safety, effect on the economy, whether or not they're entering legally (and if not how unfair and upsetting that is), that they're not willing to learn English",1. Worried,0.5
446,nothing,1. Worried,0.5
